{
  "assumption_id": "ASSUMPTION-VENDOR-READBACK-001",
  "statement": "The configured vendor environment provides authoritative readback by a stable external request identity.",
  "basis": [
    {
      "artifact_id": "ARTIFACT-VENDOR-DOC-001",
      "media_type": "text/html",
      "digest": "sha256:1111111111111111111111111111111111111111111111111111111111111111",
      "locator": "governed://research/vendor-readback-reference",
      "sensitivity": "internal",
      "retention_class": "architecture-research"
    }
  ],
  "confidence": 0.72,
  "valid_from": "2026-07-28",
  "review_by": "2026-08-15",
  "falsifiers": [
    "Configured-environment testing finds that the request identity is absent from the supported query surface.",
    "Readback returns a projection that omits the canonical identity or revision needed for reconciliation."
  ],
  "material_effect_if_false": "The adapter routes ambiguous writes to manual scientific review while the team selects another supported reconciliation identity.",
  "owner": {
    "actor_id": "OWNER-VENDOR-001",
    "display_name": "Vendor Qualification Lead",
    "role": "Vendor conformance owner",
    "organization": "Example Laboratory"
  },
  "status": "active",
  "metadata": {
    "schema_version": "0.1.0",
    "created_at": "2026-07-28T14:20:00Z",
    "updated_at": "2026-07-28T14:20:00Z",
    "owner": {
      "actor_id": "OWNER-VENDOR-001",
      "display_name": "Vendor Qualification Lead",
      "role": "Vendor conformance owner",
      "organization": "Example Laboratory"
    }
  }
}
